{
  "schema": "cil-mode-switch-capability-record/v1",
  "surface": "surface-alpha",
  "recordId": "fixture-surface-alpha",
  "establishedAt": "2026-08-23",
  "establishedOutsideEvaluationCall": true,
  "capabilities": {
    "freshSessionEntry": {
      "state": "PROVEN",
      "evidence": "Synthetic fixture: entry hook observed at install time.",
      "evidenceIdentity": "sha256:87603032bd53df7afca79eb1689fb1ba0e64fd14241661a1ae91f63bb86dc0be",
      "directEvidence": "Fixture install observed the entry event.",
      "evidenceBasis": "SURFACE_INSPECTED",
      "evidencePath": "artifacts/surface-alpha-install-observation.json"
    },
    "explicitSwitch": {
      "state": "POSSIBLE_UNPROVEN",
      "evidence": "Synthetic fixture: no explicit switch binding was exercised.",
      "evidenceIdentity": null,
      "directEvidence": null
    },
    "compactionSignal": {
      "state": "POSSIBLE_UNPROVEN",
      "evidence": "Synthetic fixture: compaction signal not exercised.",
      "evidenceIdentity": null,
      "directEvidence": null
    },
    "softRefresh": {
      "state": "ABSENT",
      "evidence": "Synthetic fixture: no heartbeat or threshold signal.",
      "evidenceIdentity": null,
      "directEvidence": null
    },
    "standingResidency": {
      "state": "PROVEN",
      "evidence": "Synthetic fixture: standing stack loaded at install time.",
      "evidenceIdentity": "sha256:87603032bd53df7afca79eb1689fb1ba0e64fd14241661a1ae91f63bb86dc0be",
      "directEvidence": "Fixture install observed the standing stack load.",
      "evidenceBasis": "SURFACE_INSPECTED",
      "evidencePath": "artifacts/surface-alpha-install-observation.json"
    },
    "sourceIdentityRead": {
      "state": "PROVEN",
      "evidence": "Synthetic fixture: source identity read path present.",
      "evidenceIdentity": "sha256:87603032bd53df7afca79eb1689fb1ba0e64fd14241661a1ae91f63bb86dc0be",
      "directEvidence": "Fixture install resolved a source identity.",
      "evidenceBasis": "SURFACE_INSPECTED",
      "evidencePath": "artifacts/surface-alpha-install-observation.json"
    },
    "authorityRead": {
      "state": "PROVEN",
      "evidence": "Synthetic fixture: authority read path present.",
      "evidenceIdentity": "sha256:87603032bd53df7afca79eb1689fb1ba0e64fd14241661a1ae91f63bb86dc0be",
      "directEvidence": "Fixture install resolved an authority record.",
      "evidenceBasis": "SURFACE_INSPECTED",
      "evidencePath": "artifacts/surface-alpha-install-observation.json"
    },
    "triggerAttachment": {
      "state": "NOT_APPLICABLE",
      "evidence": "Synthetic fixture: the install inspected this surface's own trigger interface and found it exposes no trigger-attachment introspection.",
      "evidenceIdentity": "sha256:87603032bd53df7afca79eb1689fb1ba0e64fd14241661a1ae91f63bb86dc0be",
      "directEvidence": "Fixture install read the published trigger interface and recorded SURFACE_EXPOSES_NO_SUCH_CAPABILITY.",
      "evidenceBasis": "SURFACE_INSPECTED",
      "evidencePath": "artifacts/surface-alpha-install-observation.json"
    },
    "structuralBoundary": {
      "state": "ABSENT",
      "evidence": "Synthetic fixture: no detectable structural work boundary.",
      "evidenceIdentity": null,
      "directEvidence": null
    }
  }
}
