{
  "schema": "cil-mode-switch-capability-record/v1",
  "surface": "surface-beta",
  "recordId": "fixture-surface-beta",
  "establishedAt": "2026-08-23",
  "establishedOutsideEvaluationCall": true,
  "capabilities": {
    "freshSessionEntry": {
      "state": "PROVEN",
      "evidence": "Synthetic fixture: entry hook observed at install time.",
      "evidenceIdentity": "sha256:ad99621425171da196855e8f5fafd2a8b4073ca31ae4d08594fb80ab03cb6f22",
      "directEvidence": "Fixture install observed the entry event.",
      "evidenceBasis": "SURFACE_INSPECTED",
      "evidencePath": "artifacts/surface-beta-install-observation.json"
    },
    "explicitSwitch": {
      "state": "POSSIBLE_UNPROVEN",
      "evidence": "Synthetic fixture: no explicit switch binding was exercised.",
      "evidenceIdentity": null,
      "directEvidence": null
    },
    "compactionSignal": {
      "state": "POSSIBLE_UNPROVEN",
      "evidence": "Synthetic fixture: compaction signal not exercised.",
      "evidenceIdentity": null,
      "directEvidence": null
    },
    "softRefresh": {
      "state": "ABSENT",
      "evidence": "Synthetic fixture: no heartbeat or threshold signal.",
      "evidenceIdentity": null,
      "directEvidence": null
    },
    "standingResidency": {
      "state": "PROVEN",
      "evidence": "Synthetic fixture: standing stack loaded at install time.",
      "evidenceIdentity": "sha256:ad99621425171da196855e8f5fafd2a8b4073ca31ae4d08594fb80ab03cb6f22",
      "directEvidence": "Fixture install observed the standing stack load.",
      "evidenceBasis": "SURFACE_INSPECTED",
      "evidencePath": "artifacts/surface-beta-install-observation.json"
    },
    "sourceIdentityRead": {
      "state": "PROVEN",
      "evidence": "Synthetic fixture: source identity read path present.",
      "evidenceIdentity": "sha256:ad99621425171da196855e8f5fafd2a8b4073ca31ae4d08594fb80ab03cb6f22",
      "directEvidence": "Fixture install resolved a source identity.",
      "evidenceBasis": "SURFACE_INSPECTED",
      "evidencePath": "artifacts/surface-beta-install-observation.json"
    },
    "authorityRead": {
      "state": "PROVEN",
      "evidence": "Synthetic fixture: authority read path present.",
      "evidenceIdentity": "sha256:ad99621425171da196855e8f5fafd2a8b4073ca31ae4d08594fb80ab03cb6f22",
      "directEvidence": "Fixture install resolved an authority record.",
      "evidenceBasis": "SURFACE_INSPECTED",
      "evidencePath": "artifacts/surface-beta-install-observation.json"
    },
    "triggerAttachment": {
      "state": "PROVEN",
      "evidence": "Synthetic fixture: this surface exposes trigger-attachment introspection.",
      "evidenceIdentity": "sha256:ad99621425171da196855e8f5fafd2a8b4073ca31ae4d08594fb80ab03cb6f22",
      "directEvidence": "Fixture install read live trigger attachment.",
      "evidenceBasis": "SURFACE_INSPECTED",
      "evidencePath": "artifacts/surface-beta-install-observation.json"
    },
    "structuralBoundary": {
      "state": "PROVEN",
      "evidence": "Synthetic fixture: a structural work boundary event is exposed.",
      "evidenceIdentity": "sha256:ad99621425171da196855e8f5fafd2a8b4073ca31ae4d08594fb80ab03cb6f22",
      "directEvidence": "Fixture install observed a boundary event.",
      "evidenceBasis": "SURFACE_INSPECTED",
      "evidencePath": "artifacts/surface-beta-install-observation.json"
    }
  }
}
